<?xml version="1.0" encoding="utf-8" ?>

<oons:Table extends="Base" tableName="inventory"
            xmlns:xsi="http://www.w3.org/2001/XMLSchema-instance"
            xmlns:oons="http://fonrouge.tech/MOODB"
            xsi:noNamespaceSchemaLocation="/moodbxml.xsd">

    <oons:Fields>

        <oons:FieldString name="itemId" description="Inventory Item Id" required="true"/>
        <oons:FieldString name="name" description="name" required="true"/>
        <oons:FieldString name="uom" description="Unit of measure" required="true"/>
        <oons:FieldDouble name="stock" description="Stock"/>
        <oons:FieldDouble name="unitPrice" description="Unit price" required="true"/>
        <oons:FieldDate name="date" calculated="true"/>
        <oons:FieldBinary name="image"/>

    </oons:Fields>

    <oons:Index name="itemId" keyField="itemId" unique="true"/>
    <oons:Index name="name" keyField="name"/>

</oons:Table>
