<?xml version="1.0" encoding="utf-8" ?>

<oons:Table xmlns:xsi="http://www.w3.org/2001/XMLSchema-instance" xmlns:oons="http://fonrouge.tech/MOODB"
            extends="TableBase"
            tableName="invoice"
            xsi:schemaLocation="http://fonrouge.tech/MOODB http://fonrouge.tech/MOODB/moodbxml.xsd">

    <oons:Fields>

        <oons:FieldInteger name="docNumber" description="Invoice number" autoInc="true"/>
        <oons:FieldTableField name="customer" class="Customer" notNull="true"/>
        <oons:FieldDate name="date" notNull="true"/>
        <oons:FieldInteger name="daysOfCredit" notNull="true"/>
        <oons:FieldLong name="itemsCount" calculated="true"/>
        <oons:FieldBoolean name="reqShipment" notNull="true"/>
        <oons:FieldDouble name="deliveryCost" notNull="true"/>

    </oons:Fields>

    <oons:Index name="docNumber" keyField="docNumber" unique="true"/>

</oons:Table>
